{
  "schemaVersion": "1.1.0",
  "workspaceId": "00000000-0000-4000-8000-000000000004",
  "projectId": "00000000-0000-4000-8000-000000000003",
  "workItemId": "00000000-0000-4000-8000-000000000002",
  "profile": "light",
  "enabled": true,
  "workingRevisionId": "00000000-0000-4000-8000-000000000001",
  "approvedRevisionId": null,
  "updatedAt": "2026-09-24T10:00:00Z"
}
